Feature,Metalabel
Record ID,
Event Name,
WJ Letter-Word ID raw,WJ
WJ Letter-Word ID standard,WJ
WJ Work Attack raw,WJ
WJ Work Attack standard,WJ
WJ Passage Comprehension standard,WJ
WJ Oral Reading standard,WJ
WJ Sentence Reading Fluency standard,WJ
WJ Math Facts Fluency standard,WJ
WJ Calculation standard,WJ
WJ Basic Reading Skills,WJ
WJ Reading Fluency,WJ
WJ Math Calculation Skills,WJ
TOWRE Sight Word Eficiency raw,TOWRE
TOWRE Sight Word Eficiency standard,TOWRE
TOWRE Phonemic Decoding Eficiency raw,TOWRE
TOWRE Phonemic Decoding Eficiency standard,TOWRE
TOWRE Index,TOWRE
WASI Vocabulary raw,WASI
WASI Vocabulary t score,WASI
WASI Matrix Reasoning raw,WASI
WASI Matrix Reasoning t score,WASI
Full Scale 2,WASI
Full Scale 4,WASI
CTOPP Elision raw,CTOPP
CTOPP Elision standard,CTOPP
CTOPP Blending Words raw,CTOPP
CTOPP Blending Words standard,CTOPP
CTOPP Phoneme Isolation raw,CTOPP
CTOPP Phoneme Isolation standard,CTOPP
CTOPP Memory for Digits raw,CTOPP
CTOPP Memory for Digits standard,CTOPP
CTOPP Nonword Repetition raw,CTOPP
CTOPP Nonword Repetition standard,CTOPP
CTOPP Rapid Digit Naming raw,CTOPP
CTOPP Rapid Digit Naming standard,CTOPP
CTOPP Rapid Letter Naming raw,CTOPP
CTOPP Rapid Letter Naming standard,CTOPP
CTOPP Phonological Awareness,CTOPP
CTOPP Phonological Memory,CTOPP
CTOPP Rapid Symbol Naming,CTOPP